{
  "contract_version": "performance-result.v1",
  "result_id": "res_01JTEST0001",
  "status": "succeeded",
  "request_snapshot": {
    "contract_version": "performance-request.v1",
    "request_id": "req_01JTEST0001",
    "run_id": "run_01JTEST0001",
    "sample_index": 1,
    "provider": {
      "provider_id": "northstar_demo",
      "endpoint": "https://api.example.com/v1/chat/completions",
      "protocol": "openai-chat-completions",
      "credential_ref": "env:NORTHSTAR_API_KEY",
      "adapter": "openai-compatible"
    },
    "model": "gpt-5.2",
    "mode": "streaming",
    "timeout_ms": 30000,
    "input": {
      "messages": [
        { "role": "system", "content": "Reply concisely." },
        { "role": "user", "content": "Return the word ready." }
      ]
    },
    "parameters": { "temperature": 0, "max_output_tokens": 32, "seed": 42 },
    "metadata": { "test_case_id": "latency-smoke-v1", "tags": ["smoke", "streaming"] },
    "created_at": "2026-09-05T06:02:00Z"
  },
  "execution": {
    "attempt": 1,
    "worker_id": "worker-local-01",
    "worker_version": "0.1.0",
    "adapter_version": "openai-compatible@0.1.0",
    "started_at": "2026-09-05T06:02:01.000Z",
    "completed_at": "2026-09-05T06:02:02.240Z"
  },
  "timing": {
    "duration_clock": "monotonic",
    "dns_completed_ms": 12.4,
    "connect_completed_ms": 34.1,
    "tls_completed_ms": 71.8,
    "response_headers_ms": 198.2,
    "first_byte_ms": 204.7,
    "first_content_ms": 428.3,
    "response_completed_ms": 1240.0
  },
  "raw_response": {
    "http_status": 200,
    "provider_request_id": "provider-request-demo-001",
    "headers": {
      "content-type": "text/event-stream",
      "x-request-id": "provider-request-demo-001"
    },
    "media_type": "text/event-stream",
    "body_text": "data: {\"choices\":[{\"delta\":{\"role\":\"assistant\"}}]}\n\ndata: {\"choices\":[{\"delta\":{\"content\":\"ready\"},\"finish_reason\":null}]}\n\ndata: [DONE]\n\n",
    "body_sha256": "b6d0d51cd08bcb8c7030f497e4b1b7aade4d800eb82af0f2f08b14a868012a5a",
    "bytes_received": 138,
    "credential_redacted": false,
    "truncated": false
  },
  "usage": {
    "source": "provider",
    "input_tokens": 18,
    "output_tokens": 1,
    "total_tokens": 19
  },
  "error": null
}
